8,CATAMARAN2-FIN-Misma,No Constraint,Mismatch,her,"While someone read her a bedtime story, William gently gestured to Olivia to turn off the lights.","While someone read her a bedtime story, the","While someone read her a bedtime story, the MASKTOKEN gently gestured to Olivia to turn off the lights.","While someone read her a bedtime story, the",man,8.288186073303223,8.853182792663574,8.251070976257324,8.471904754638672,8.348727226257324,8.709952354431152,7.6400346755981445,8.773200988769531,8.227338790893555,7.872410297393799,9.01044750213623,8.526350975036621,7.965298175811768,8.381454467773438,8.398591995239258,8.567036628723145,7.844914436340332,7.800866603851318,8.141942977905273,7.197963714599609,8.736214637756348,8.396279335021973,8.417354583740234,7.713482856750488,9.11072063446045
8,CATAMARAN2-OBJ-Match,Constraint,Match,him,"While reading him a bedtime story, William gently gestured to Luis to turn off the lights.","While reading him a bedtime story, the","While reading him a bedtime story, the MASKTOKEN gently gestured to Luis to turn off the lights.","While reading him a bedtime story, the",man,8.114964485168457,8.70500373840332,8.422407150268555,8.892157554626465,8.702430725097656,8.61109733581543,7.877283573150635,8.541988372802734,8.026337623596191,7.5739665031433105,8.833165168762207,8.227997779846191,7.732565402984619,8.420675277709961,8.525128364562988,8.311254501342773,7.314727306365967,7.752207279205322,7.964178085327148,7.075972080230713,8.811151504516602,8.208638191223145,7.940419673919678,7.652969837188721,8.933595657348633
8,CATAMARAN2-OBJ-Misma,Constraint,Mismatch,her,"While reading her a bedtime story, William gently gestured to Olivia to turn off the lights.","While reading her a bedtime story, the","While reading her a bedtime story, the MASKTOKEN gently gestured to Olivia to turn off the lights.","While reading her a bedtime story, the",man,8.516777038574219,9.198346138000488,8.611834526062012,8.809691429138184,9.479269027709961,9.062179565429688,8.600306510925293,9.145341873168945,8.379203796386719,7.883659839630127,9.305130958557129,8.432025909423828,8.048866271972656,8.99278736114502,8.911986351013184,8.769493103027344,7.796967029571533,8.133623123168945,8.511225700378418,7.646864414215088,9.249869346618652,8.630504608154297,8.602718353271484,8.02039623260498,9.555337905883789
9,CATAMARAN2-FIN-Match,No Constraint,Match,him,"After a colleague cornered him next to the water cooler, Robert loudly insulted Jorge much to everyone's horror.","After a colleague cornered him next to the water cooler, the","After a colleague cornered him next to the water cooler, the MASKTOKEN loudly insulted Jorge much to everyone's horror.","After a colleague cornered him next to the water cooler, the",man,7.369339466094971,7.936306953430176,7.1908650398254395,7.045534610748291,7.084708213806152,7.707619667053223,7.816266059875488,7.334743976593018,8.420289039611816,6.952622890472412,6.905067443847656,8.508856773376465,7.461977481842041,7.357187747955322,7.552466869354248,7.324831962585449,7.447019100189209,7.0290374755859375,7.622769832611084,6.240460395812988,8.376150131225586,7.521387577056885,7.725003719329834,6.905169486999512,7.549602031707764
9,CATAMARAN2-FIN-Misma,No Constraint,Mismatch,her,"After a colleague cornered her next to the water cooler, Robert loudly insulted Annie much to everyone's horror.","After a colleague cornered her next to the water cooler, the","After a colleague cornered her next to the water cooler, the MASKTOKEN loudly insulted Annie much to everyone's horror.","After a colleague cornered her next to the water cooler, the",man,7.889562129974365,8.416339874267578,7.539668560028076,7.526869297027588,7.624731063842773,8.277812004089355,8.089162826538086,7.665576934814453,8.799708366394043,7.172309875488281,7.183643817901611,8.608440399169922,8.043216705322266,8.0058012008667,7.81755256652832,7.794411659240723,7.5754804611206055,7.5187458992004395,8.182821273803711,6.905168056488037,8.518248558044434,7.992466926574707,8.197244644165039,7.239948272705078,7.955368518829346
9,CATAMARAN2-OBJ-Match,Constraint,Match,him,"After cornering him next to the water cooler, Robert loudly insulted Jorge much to everyone's horror.","After cornering him next to the water cooler, the","After cornering him next to the water cooler, the MASKTOKEN loudly insulted Jorge much to everyone's horror.","After cornering him next to the water cooler, the",man,7.5852766036987305,8.268841743469238,7.878407001495361,7.853309631347656,7.28989315032959,8.57779598236084,8.707697868347168,7.983705043792725,8.672843933105469,7.269026279449463,7.784467697143555,8.573939323425293,7.392221450805664,8.187400817871094,8.254842758178711,8.202205657958984,7.921025276184082,7.3478851318359375,8.041718482971191,6.961081027984619,8.6221342086792,8.191301345825195,8.294839859008789,7.534176826477051,8.302802085876465
9,CATAMARAN2-OBJ-Misma,Constraint,Mismatch,her,"After cornering her next to the water cooler, Robert loudly insulted Annie much to everyone's horror.","After cornering her next to the water cooler, the","After cornering her next to the water cooler, the MASKTOKEN loudly insulted Annie much to everyone's horror.","After cornering her next to the water cooler, the",man,8.112335205078125,8.799212455749512,8.314469337463379,8.373551368713379,8.35385799407959,9.053009986877441,9.062088966369629,8.298441886901855,8.952736854553223,7.622387886047363,8.363548278808594,8.846760749816895,8.11677360534668,9.056497573852539,8.616022109985352,9.079150199890137,8.02973461151123,8.111894607543945,8.349577903747559,7.768775463104248,8.623811721801758,8.3765230178833,8.718262672424316,8.064448356628418,8.95126724243164
10,CATAMARAN2-FIN-Match,No Constraint,Match,him,"After a nurse weighed him on the scale, Johnathan calmly informed Steven that he should be concerned about the onset of gout.","After a nurse weighed him on the scale, the","After a nurse weighed him on the scale, the MASKTOKEN calmly informed Steven that he should be concerned about the onset of gout.","After a nurse weighed him on the scale, the",man,7.607603073120117,7.746411323547363,7.22391939163208,8.288647651672363,7.541093826293945,8.43044662475586,7.764038562774658,7.7439165115356445,7.939788818359375,7.189145088195801,8.086010932922363,7.876957416534424,7.851924419403076,8.00527286529541,7.92360258102417,7.767693996429443,7.184755325317383,8.37484359741211,7.599673271179199,6.431035995483398,7.674646377563477,7.703312873840332,8.547548294067383,7.6584696769714355,7.096411228179932
10,CATAMARAN2-FIN-Misma,No Constraint,Mismatch,her,"After a nurse weighed her on the scale, Johnathan calmly informed Michelle that she should be concerned about the onset of gout.","After a nurse weighed her on the scale, the","After a nurse weighed her on the scale, the MASKTOKEN calmly informed Michelle that she should be concerned about the onset of gout.","After a nurse weighed her on the scale, the",man,8.023590087890625,8.3139066696167,7.3563127517700195,8.563819885253906,8.12082576751709,8.588747024536133,8.269378662109375,8.244409561157227,8.208585739135742,7.525790691375732,8.41606330871582,7.877054214477539,8.19056224822998,8.340131759643555,8.280019760131836,8.03016185760498,7.491824150085449,8.656495094299316,7.883851051330566,7.009894371032715,7.801031589508057,7.989846229553223,8.83914852142334,8.047246932983398,7.430770397186279
10,CATAMARAN2-OBJ-Match,Constraint,Match,him,"After weighing him on the scale, Johnathan calmly informed Steven that he should be concerned about the onset of gout.","After weighing him on the scale, the","After weighing him on the scale, the MASKTOKEN calmly informed Steven that he should be concerned about the onset of gout.","After weighing him on the scale, the",man,8.157365798950195,8.595108032226562,7.610592842102051,8.044676780700684,8.337240219116211,9.270549774169922,8.929656028747559,8.028831481933594,8.833833694458008,7.7993011474609375,8.438272476196289,8.114531517028809,7.987833023071289,8.481234550476074,8.789153099060059,7.885375499725342,7.584921836853027,8.668644905090332,8.570318222045898,7.345574378967285,8.512618064880371,8.061104774475098,8.621264457702637,8.243882179260254,8.007011413574219
10,CATAMARAN2-OBJ-Misma,Constraint,Mismatch,her,"After weighing her on the scale, Johnathan calmly informed Michelle that she should be concerned about the onset of gout.","After weighing her on the scale, the","After weighing her on the scale, the MASKTOKEN calmly informed Michelle that she should be concerned about the onset of gout.","After weighing her on the scale, the",man,8.643632888793945,8.978010177612305,7.8722100257873535,8.560850143432617,8.944101333618164,9.656559944152832,8.975615501403809,8.675576210021973,9.072465896606445,7.996245384216309,8.875853538513184,8.332037925720215,8.492857933044434,9.20264720916748,9.550895690917969,8.539401054382324,8.175453186035156,9.225659370422363,8.801569938659668,8.131680488586426,8.823389053344727,8.45026683807373,8.8887357711792,8.589845657348633,8.312325477600098
11,CATAMARAN2-FIN-Match,No Constraint,Match,him,"Before anyone spotted him at yoga class, Zachary secretly followed Christian around town.","Before anyone spotted him at yoga class, the","Before anyone spotted him at yoga class, the MASKTOKEN secretly followed Christian around town.","Before anyone spotted him at yoga class, the",man,8.37222957611084,7.626080513000488,7.726397514343262,7.672682762145996,7.795121192932129,7.966942310333252,8.911914825439453,7.783691883087158,8.330009460449219,7.656373977661133,8.533008575439453,8.278411865234375,7.665144920349121,7.978057861328125,8.668700218200684,7.944158554077148,7.413516998291016,7.6886796951293945,8.055968284606934,6.803517818450928,8.143568992614746,8.095208168029785,8.169136047363281,7.055882453918457,8.101995468139648
11,CATAMARAN2-FIN-Misma,No Constraint,Mismatch,her,"Before anyone spotted her at yoga class, Zachary secretly followed Kaitlyn around town.","Before anyone spotted her at yoga class, the","Before anyone spotted her at yoga class, the MASKTOKEN secretly followed Kaitlyn around town.","Before anyone spotted her at yoga class, the",man,8.784931182861328,7.8723063468933105,8.0428466796875,8.164590835571289,8.457067489624023,8.253103256225586,9.122767448425293,8.205097198486328,8.519804000854492,7.866396427154541,8.880084991455078,8.583118438720703,8.248522758483887,8.699469566345215,8.849038124084473,8.470701217651367,7.723715782165527,8.155818939208984,8.46609878540039,7.286920547485352,8.37992000579834,8.433167457580566,8.347396850585938,7.39790678024292,8.373538970947266
11,CATAMARAN2-OBJ-Match,Constraint,Match,him,"Before spotting him at yoga class, Zachary secretly followed Christian around town.","Before spotting him at yoga class, the","Before spotting him at yoga class, the MASKTOKEN secretly followed Christian around town.","Before spotting him at yoga class, the",man,8.766279220581055,8.116308212280273,8.301827430725098,7.7613301277160645,8.347977638244629,8.635916709899902,9.40660572052002,8.005261421203613,8.595391273498535,7.830491065979004,8.982553482055664,8.421210289001465,7.760356426239014,8.229113578796387,9.027153015136719,8.21187686920166,7.53815221786499,8.180763244628906,8.358861923217773,6.92071533203125,8.251325607299805,8.409135818481445,8.26153564453125,7.397984981536865,8.661149024963379
11,CATAMARAN2-OBJ-Misma,Constraint,Mismatch,her,"Before spotting her at yoga class, Zachary secretly followed Kaitlyn around town.","Before spotting her at yoga class, the","Before spotting her at yoga class, the MASKTOKEN secretly followed Kaitlyn around town.","Before spotting her at yoga class, the",man,9.139978408813477,8.522684097290039,8.620869636535645,8.341504096984863,9.151243209838867,9.261903762817383,9.536170959472656,8.48364543914795,8.752363204956055,8.112930297851562,9.515768051147461,8.737309455871582,8.266472816467285,8.922574043273926,9.235603332519531,8.805749893188477,7.918885231018066,8.696634292602539,8.917001724243164,7.676067352294922,8.674423217773438,8.742716789245605,8.584179878234863,7.651042938232422,8.90674877166748
12,CATAMARAN2-FIN-Match,No Constraint,Match,him,"Before friends visited him on Sunday afternoons, Benjamin usually called Jason up to confirm that they were still free.","Before friends visited him on Sunday afternoons, the","Before friends visited him on Sunday afternoons, the MASKTOKEN usually called Jason up to confirm that they were still free.","Before friends visited him on Sunday afternoons, the",man,9.464911460876465,8.483439445495605,8.281655311584473,8.02943229675293,8.616782188415527,9.347261428833008,9.286694526672363,8.329583168029785,9.197612762451172,8.284852981567383,9.348163604736328,9.042115211486816,8.415929794311523,9.054886817932129,9.247116088867188,8.257287979125977,8.133684158325195,8.629081726074219,8.53062629699707,8.146636009216309,8.930789947509766,9.167695045471191,8.49862003326416,8.429397583007812,9.444010734558105
12,CATAMARAN2-FIN-Misma,No Constraint,Mismatch,her,"Before friends visited her on Sunday afternoons, Benjamin usually called Mary up to confirm that they were still free.","Before friends visited her on Sunday afternoons, the","Before friends visited her on Sunday afternoons, the MASKTOKEN usually called Mary up to confirm that they were still free.","Before friends visited her on Sunday afternoons, the",man,9.884014129638672,8.755728721618652,8.710830688476562,8.553024291992188,8.84817123413086,9.749085426330566,9.623475074768066,8.549493789672852,9.188105583190918,8.546506881713867,9.662395477294922,9.338890075683594,8.87348461151123,9.609280586242676,9.443211555480957,8.598769187927246,8.458837509155273,9.009671211242676,8.915000915527344,8.588979721069336,8.930724143981934,9.369646072387695,8.867427825927734,8.744170188903809,9.670989990234375
12,CATAMARAN2-OBJ-Match,Constraint,Match,him,"Before visiting him on Sunday afternoons, Benjamin usually called Jason up to confirm that he was still free.","Before visiting him on Sunday afternoons, the","Before visiting him on Sunday afternoons, the MASKTOKEN usually called Jason up to confirm that he was still free.","Before visiting him on Sunday afternoons, the",man,8.994102478027344,8.768402099609375,8.299300193786621,8.019726753234863,8.31462287902832,9.158487319946289,9.166048049926758,8.134284973144531,8.822525978088379,7.953187465667725,9.239177703857422,9.043500900268555,7.970362663269043,8.544546127319336,9.503358840942383,8.035477638244629,8.011221885681152,8.201354026794434,8.579995155334473,8.027881622314453,8.721009254455566,8.95600700378418,8.264945030212402,7.999086380004883,9.184544563293457
12,CATAMARAN2-OBJ-Misma,Constraint,Mismatch,her,"Before visiting her on Sunday afternoons, Benjamin usually called Mary up to confirm that she was still free.","Before visiting her on Sunday afternoons, the","Before visiting her on Sunday afternoons, the MASKTOKEN usually called Mary up to confirm that she was still free.","Before visiting her on Sunday afternoons, the",man,9.394579887390137,9.117803573608398,8.589126586914062,8.583107948303223,8.889984130859375,9.571742057800293,9.644954681396484,8.435164451599121,8.97359848022461,8.26147174835205,9.537306785583496,9.310291290283203,8.392029762268066,9.113861083984375,9.594351768493652,8.54238224029541,8.224236488342285,8.538030624389648,8.919432640075684,8.581311225891113,8.7566499710083,9.175057411193848,8.653882026672363,8.387285232543945,9.358939170837402
13,CATAMARAN2-FIN-Match,No Constraint,Match,her,"After a professor had her in multiple classes, Jessica finally admitted to Sydney that she was a little uncomfortable about the whole deal.","After a professor had her in multiple classes, the","After a professor had her in multiple classes, the MASKTOKEN finally admitted to Sydney that she was a little uncomfortable about the whole deal.","After a professor had her in multiple classes, the",woman,9.387517929077148,8.346169471740723,8.336556434631348,8.612604141235352,9.779248237609863,8.9744234085083,9.35863971710205,8.70320987701416,9.369474411010742,8.159010887145996,9.957292556762695,10.189664840698242,9.4271240234375,8.880837440490723,9.558655738830566,9.400774955749512,9.764128684997559,9.073659896850586,9.023466110229492,8.668622970581055,9.297633171081543,9.13530445098877,9.894983291625977,8.839767456054688,8.912171363830566
13,CATAMARAN2-FIN-Misma,No Constraint,Mismatch,him,"After a professor had him in multiple classes, Jessica finally admitted to Richard that she was a little uncomfortable about the whole deal.","After a professor had him in multiple classes, the","After a professor had him in multiple classes, the MASKTOKEN finally admitted to Richard that she was a little uncomfortable about the whole deal.","After a professor had him in multiple classes, the",woman,10.331750869750977,9.636001586914062,9.338643074035645,9.488966941833496,10.560541152954102,10.417590141296387,10.112872123718262,10.451273918151855,9.873093605041504,9.352887153625488,10.933100700378418,10.640803337097168,9.965039253234863,9.657156944274902,10.530801773071289,10.36483383178711,10.686620712280273,10.391417503356934,9.920247077941895,9.877567291259766,9.962404251098633,10.289834976196289,11.513978958129883,10.01266860961914,9.815363883972168
13,CATAMARAN2-OBJ-Match,Constraint,Match,her,"After having her in multiple classes, Jessica finally admitted to Sydney that she was a little uncomfortable about the whole deal.","After having her in multiple classes, the","After having her in multiple classes, the MASKTOKEN finally admitted to Sydney that she was a little uncomfortable about the whole deal.","After having her in multiple classes, the",woman,9.364471435546875,7.9084954261779785,8.631450653076172,8.474194526672363,8.67595386505127,8.277487754821777,9.548365592956543,8.353684425354004,8.566650390625,7.77726936340332,9.83679485321045,9.889769554138184,9.432929039001465,8.139263153076172,9.549537658691406,9.68687629699707,8.945261001586914,8.43268871307373,8.713944435119629,8.537978172302246,9.322174072265625,9.109809875488281,9.234404563903809,8.709693908691406,8.705570220947266
13,CATAMARAN2-OBJ-Misma,Constraint,Mismatch,him,"After having him in multiple classes, Jessica finally admitted to Richard that she was a little uncomfortable about the whole deal.","After having him in multiple classes, the","After having him in multiple classes, the MASKTOKEN finally admitted to Richard that she was a little uncomfortable about the whole deal.","After having him in multiple classes, the",woman,10.245827674865723,9.478080749511719,9.761001586914062,9.583620071411133,9.993285179138184,10.112407684326172,10.30313491821289,10.078653335571289,9.698803901672363,9.130060195922852,10.783445358276367,10.611414909362793,9.938752174377441,9.407000541687012,10.831701278686523,10.748355865478516,10.025426864624023,9.8777494430542,9.739778518676758,10.043002128601074,10.072113037109375,10.3045072555542,10.98236083984375,9.948521614074707,9.67054271697998
14,CATAMARAN2-FIN-Match,No Constraint,Match,her,"After a stranger bought her a pumpkin-spice latte, Samantha generously offered Tiffany the best seat at the conference table.","After a stranger bought her a pumpkin-spice latte, the","After a stranger bought her a pumpkin-spice latte, the MASKTOKEN generously offered Tiffany the best seat at the conference table.","After a stranger bought her a pumpkin-spice latte, the",woman,7.847078323364258,7.779244899749756,7.7896199226379395,7.419045448303223,8.503840446472168,8.031944274902344,8.08601188659668,8.69301700592041,8.307333946228027,7.593316078186035,8.912991523742676,9.144977569580078,8.384020805358887,7.153646469116211,8.51960277557373,8.398670196533203,7.752232551574707,7.805660724639893,8.597949981689453,8.517698287963867,8.51713752746582,8.620938301086426,8.73468017578125,7.82454252243042,8.342007637023926
14,CATAMARAN2-FIN-Misma,No Constraint,Mismatch,him,"After a stranger bought him a pumpkin-spice latte, Samantha generously offered Austin the best seat at the conference table.","After a stranger bought him a pumpkin-spice latte, the","After a stranger bought him a pumpkin-spice latte, the MASKTOKEN generously offered Austin the best seat at the conference table.","After a stranger bought him a pumpkin-spice latte, the",woman,8.654678344726562,8.537406921386719,8.802024841308594,8.343923568725586,9.143997192382812,8.71925163269043,8.604276657104492,9.923726081848145,8.966364860534668,8.236897468566895,9.322044372558594,9.630523681640625,9.01131534576416,8.004944801330566,9.121795654296875,9.280366897583008,8.927075386047363,8.626799583435059,9.209417343139648,9.985937118530273,9.144122123718262,9.003657341003418,9.98460578918457,8.939385414123535,8.704202651977539
14,CATAMARAN2-OBJ-Match,Constraint,Match,her,"After buying her a pumpkin-spice latte, Samantha generously offered Tiffany the best seat at the conference table.","After buying her a pumpkin-spice latte, the","After buying her a pumpkin-spice latte, the MASKTOKEN generously offered Tiffany the best seat at the conference table.","After buying her a pumpkin-spice latte, the",woman,8.086054801940918,8.106585502624512,8.361945152282715,8.143120765686035,8.236847877502441,8.805899620056152,8.655747413635254,9.029430389404297,9.14350700378418,8.019984245300293,9.758133888244629,9.364153861999512,8.540369033813477,7.99160099029541,9.354239463806152,8.656925201416016,8.332024574279785,7.882601737976074,8.597484588623047,8.782256126403809,9.100974082946777,9.035146713256836,8.906598091125488,7.721027374267578,8.923849105834961
14,CATAMARAN2-OBJ-Misma,Constraint,Mismatch,him,"After buying him a pumpkin-spice latte, Samantha generously offered Austin the best seat at the conference table.","After buying him a pumpkin-spice latte, the","After buying him a pumpkin-spice latte, the MASKTOKEN generously offered Austin the best seat at the conference table.","After buying him a pumpkin-spice latte, the",woman,9.09097671508789,8.995102882385254,9.381383895874023,9.17806625366211,8.87809944152832,9.754106521606445,9.314401626586914,10.095687866210938,9.679302215576172,8.941624641418457,10.284231185913086,9.917448043823242,9.111170768737793,8.826399803161621,9.941024780273438,9.729194641113281,9.757186889648438,8.800451278686523,9.1945161819458,10.047144889831543,9.892913818359375,9.525808334350586,10.257878303527832,9.095742225646973,9.299715995788574
15,CATAMARAN2-FIN-Match,No Constraint,Match,her,"While someone writing her a reminder note, Amanda vigorously scolded Chelsea for being so forgetful about important appointments.","While someone writing her a reminder note, the","While someone writing her a reminder note, the MASKTOKEN vigorously scolded Chelsea for being so forgetful about important appointments.","While someone writing her a reminder note, the",woman,8.652900695800781,8.012332916259766,8.51476001739502,8.558855056762695,7.402288436889648,8.049251556396484,8.658353805541992,8.101457595825195,8.548785209655762,7.857986927032471,9.6712007522583,9.772096633911133,8.738601684570312,8.50417709350586,9.630228042602539,9.339168548583984,8.346742630004883,8.666160583496094,9.030932426452637,9.019587516784668,8.610576629638672,8.9241943359375,9.70156478881836,8.993371963500977,8.717046737670898
15,CATAMARAN2-FIN-Misma,No Constraint,Mismatch,him,"While someone writing him a reminder note, Amanda vigorously scolded Antonio for being so forgetful about important appointments.","While someone writing him a reminder note, the","While someone writing him a reminder note, the MASKTOKEN vigorously scolded Antonio for being so forgetful about important appointments.","While someone writing him a reminder note, the",woman,9.486960411071777,9.728815078735352,9.724525451660156,9.643057823181152,8.974570274353027,10.12382984161377,9.614004135131836,9.182137489318848,9.356197357177734,9.328424453735352,10.879616737365723,10.482967376708984,9.409772872924805,10.03628158569336,10.721436500549316,9.982439994812012,9.708015441894531,9.623433113098145,9.597550392150879,10.662101745605469,9.533775329589844,9.707038879394531,11.124756813049316,10.226587295532227,9.720861434936523
15,CATAMARAN2-OBJ-Match,Constraint,Match,her,"While writing her a reminder note, Amanda vigorously scolded Chelsea for being so forgetful about important appointments.","While writing her a reminder note, the","While writing her a reminder note, the MASKTOKEN vigorously scolded Chelsea for being so forgetful about important appointments.","While writing her a reminder note, the",woman,9.290731430053711,8.92398452758789,9.444875717163086,9.480031967163086,8.970212936401367,8.93026351928711,9.58846664428711,8.804343223571777,8.791990280151367,8.157488822937012,10.20646858215332,10.584186553955078,9.294425010681152,9.18049430847168,10.1184720993042,10.055217742919922,8.910929679870605,8.755046844482422,9.572700500488281,10.146463394165039,9.205241203308105,9.952678680419922,9.597040176391602,9.081547737121582,9.621169090270996
15,CATAMARAN2-OBJ-Misma,Constraint,Mismatch,him,"While writing him a reminder note, Amanda vigorously scolded Antonio for being so forgetful about important appointments.","While writing him a reminder note, the","While writing him a reminder note, the MASKTOKEN vigorously scolded Antonio for being so forgetful about important appointments.","While writing him a reminder note, the",woman,10.00490665435791,10.646471977233887,10.806269645690918,10.778388977050781,10.566340446472168,10.8355073928833,10.753084182739258,9.722417831420898,9.9431734085083,9.214421272277832,11.168641090393066,11.15095329284668,10.160713195800781,10.63090991973877,11.126189231872559,10.709003448486328,9.953160285949707,9.899054527282715,10.351051330566406,11.554625511169434,10.009124755859375,10.44058609008789,11.191913604736328,10.387277603149414,10.445610046386719
