16,CATAMARAN2-FIN-Match,No Constraint,Match,her,"After a waiter poured her some hot tea, Britney accidentally burned Natalie by knocking the nearly full pot off the table.","After a waiter poured her some hot tea, the","After a waiter poured her some hot tea, the MASKTOKEN accidentally burned Natalie by knocking the nearly full pot off the table.","After a waiter poured her some hot tea, the",woman,7.280710697174072,7.997784614562988,7.492448806762695,6.756565570831299,8.496783256530762,7.473716735839844,7.576135635375977,7.638283729553223,7.837810039520264,6.776544094085693,7.81444787979126,8.990955352783203,7.395013809204102,6.843996524810791,7.891260147094727,8.395560264587402,7.541171073913574,6.493026256561279,6.637010097503662,8.528648376464844,8.416556358337402,8.05931568145752,7.9132256507873535,8.571537017822266,7.900333881378174
16,CATAMARAN2-FIN-Misma,No Constraint,Mismatch,him,"After a waiter poured him some hot tea, Britney accidentally burned Peter by knocking the nearly full pot off the table.","After a waiter poured him some hot tea, the","After a waiter poured him some hot tea, the MASKTOKEN accidentally burned Peter by knocking the nearly full pot off the table.","After a waiter poured him some hot tea, the",woman,8.082839965820312,8.820515632629395,8.016451835632324,7.8805694580078125,9.641202926635742,8.70328140258789,8.243660926818848,8.819806098937988,8.435783386230469,7.90719747543335,8.646955490112305,9.475552558898926,8.276152610778809,8.034993171691895,8.475894927978516,9.313472747802734,8.603309631347656,7.426456928253174,8.073503494262695,10.048295021057129,9.115396499633789,8.831307411193848,9.510978698730469,9.085016250610352,8.949957847595215
16,CATAMARAN2-OBJ-Match,Constraint,Match,her,"After pouring her some hot tea, Britney accidentally burned Natalie by knocking the nearly full pot off the table.","After pouring her some hot tea, the","After pouring her some hot tea, the MASKTOKEN accidentally burned Natalie by knocking the nearly full pot off the table.","After pouring her some hot tea, the",woman,8.004121780395508,8.775209426879883,8.333971977233887,7.583874702453613,8.741147994995117,8.25556468963623,7.831468105316162,7.882213592529297,8.973854064941406,7.631161689758301,8.594442367553711,9.990925788879395,8.9592924118042,7.583225250244141,9.773963928222656,8.43287181854248,8.191651344299316,7.279712677001953,8.253949165344238,8.602707862854004,8.618505477905273,9.06704330444336,8.432302474975586,8.768784523010254,7.773200035095215
16,CATAMARAN2-OBJ-Misma,Constraint,Mismatch,him,"After pouring him some hot tea, Britney accidentally burned Peter by knocking the nearly full pot off the table.","After pouring him some hot tea, the","After pouring him some hot tea, the MASKTOKEN accidentally burned Peter by knocking the nearly full pot off the table.","After pouring him some hot tea, the",woman,8.930705070495605,9.78071403503418,9.376141548156738,9.1909761428833,10.488818168640137,9.536628723144531,8.91824722290039,9.759048461914062,9.981221199035645,8.95899486541748,9.917577743530273,10.597003936767578,9.781270027160645,8.983360290527344,10.359105110168457,9.6899995803833,9.498269081115723,8.546788215637207,8.889627456665039,10.032655715942383,9.391363143920898,9.759822845458984,10.312548637390137,9.580492973327637,9.461954116821289
17,CATAMARAN2-FIN-Match,No Constraint,Match,her,"After a volunteer left her a voice message, Stephanie also sent Marissa a text containing the same information.","After a volunteer left her a voice message, the","After a volunteer left her a voice message, the MASKTOKEN also sent Marissa a text containing the same information.","After a volunteer left her a voice message, the",woman,7.696262836456299,7.73773717880249,6.605823040008545,7.785082817077637,7.897877216339111,7.0866923332214355,7.5723748207092285,7.7174763679504395,8.602010726928711,7.093470573425293,9.15052604675293,9.455070495605469,7.871105670928955,7.993921279907227,8.608033180236816,8.49889087677002,8.597375869750977,7.489603519439697,8.244671821594238,8.04068660736084,8.717062950134277,8.814642906188965,8.375836372375488,7.528110027313232,8.138713836669922
17,CATAMARAN2-FIN-Misma,No Constraint,Mismatch,him,"After a volunteer left him a voice message, Stephanie also sent Marcus a text containing the same information.","After a volunteer left him a voice message, the","After a volunteer left him a voice message, the MASKTOKEN also sent Marcus a text containing the same information.","After a volunteer left him a voice message, the",woman,9.154196739196777,8.751175880432129,8.229177474975586,9.002972602844238,9.205653190612793,8.665644645690918,9.035540580749512,9.314842224121094,9.625161170959473,8.464938163757324,10.15288257598877,10.269115447998047,8.522994041442871,9.171621322631836,9.453125953674316,9.364446640014648,9.357545852661133,8.480328559875488,9.512674331665039,9.564233779907227,9.874064445495605,9.707759857177734,9.965163230895996,8.830578804016113,9.327363014221191
17,CATAMARAN2-OBJ-Match,Constraint,Match,her,"After leaving her a voice message, Stephanie also sent Marissa a text containing the same information.","After leaving her a voice message, the","After leaving her a voice message, the MASKTOKEN also sent Marissa a text containing the same information.","After leaving her a voice message, the",woman,8.035568237304688,8.019244194030762,7.103377819061279,7.892783164978027,8.001255989074707,8.364521026611328,7.61650276184082,7.6940460205078125,8.25030517578125,6.940520763397217,9.386285781860352,9.391304969787598,8.038063049316406,7.615253925323486,9.103987693786621,8.802839279174805,8.556551933288574,7.797808647155762,8.35117244720459,8.589056968688965,8.926750183105469,9.129022598266602,8.80506420135498,7.2887444496154785,7.808810234069824
17,CATAMARAN2-OBJ-Misma,Constraint,Mismatch,him,"After leaving him a voice message, Stephanie also sent Marcus a text containing the same information.","After leaving him a voice message, the","After leaving him a voice message, the MASKTOKEN also sent Marcus a text containing the same information.","After leaving him a voice message, the",woman,9.475513458251953,9.009058952331543,8.749565124511719,9.213543891906738,9.394248008728027,9.848780632019043,9.05001163482666,9.600547790527344,9.21778678894043,8.56539535522461,10.396750450134277,10.35915470123291,8.591110229492188,9.44225025177002,10.088274002075195,9.666236877441406,9.770120620727539,9.044251441955566,9.504059791564941,10.243721008300781,10.100395202636719,9.966583251953125,10.239052772521973,8.598526000976562,9.137615203857422
18,CATAMARAN2-FIN-Match,No Constraint,Match,her,"After someone sent her a thank-you note, Jennifer thoughtfully bought Gabriella a nice down comforter as a token of gratitude.","After someone sent her a thank-you note, the","After someone sent her a thank-you note, the MASKTOKEN thoughtfully bought Gabriella a nice down comforter as a token of gratitude.","After someone sent her a thank-you note, the",woman,7.872695446014404,7.208630561828613,6.492778301239014,7.562126636505127,8.51309585571289,7.563020706176758,8.047603607177734,7.652278423309326,8.1332426071167,7.2061767578125,9.135891914367676,8.92434024810791,8.67128849029541,8.290271759033203,8.587456703186035,7.093986988067627,8.215827941894531,7.463006973266602,8.705320358276367,7.479093551635742,8.355534553527832,9.49178695678711,9.401905059814453,8.083821296691895,8.045381546020508
18,CATAMARAN2-FIN-Misma,No Constraint,Mismatch,him,"After someone sent him a thank-you note, Jennifer thoughtfully bought Victor a nice down comforter as a token of gratitude.","After someone sent him a thank-you note, the","After someone sent him a thank-you note, the MASKTOKEN thoughtfully bought Victor a nice down comforter as a token of gratitude.","After someone sent him a thank-you note, the",woman,8.938098907470703,8.100974082946777,7.7046003341674805,8.793929100036621,9.465044021606445,9.331168174743652,8.920138359069824,8.859955787658691,9.214035987854004,8.640069961547852,9.928751945495605,9.565391540527344,9.248946189880371,9.495617866516113,9.332213401794434,8.286467552185059,9.32593822479248,8.459059715270996,9.518732070922852,8.638404846191406,9.3202486038208,10.108405113220215,10.631856918334961,9.225129127502441,9.181044578552246
18,CATAMARAN2-OBJ-Match,Constraint,Match,her,"After sending her a thank-you note, Jennifer thoughtfully bought Gabriella a nice down comforter as a token of gratitude.","After sending her a thank-you note, the","After sending her a thank-you note, the MASKTOKEN thoughtfully bought Gabriella a nice down comforter as a token of gratitude.","After sending her a thank-you note, the",woman,8.113163948059082,7.046768665313721,6.676422595977783,7.110569000244141,8.295449256896973,7.3350605964660645,8.056731224060059,7.7350544929504395,8.255741119384766,7.568141937255859,9.078079223632812,8.917202949523926,8.740179061889648,8.59460163116455,8.664793014526367,7.210008144378662,8.220573425292969,7.43281364440918,8.621213912963867,7.285703182220459,8.3821382522583,9.222979545593262,9.115107536315918,7.922609806060791,8.299440383911133
18,CATAMARAN2-OBJ-Misma,Constraint,Mismatch,him,"After sending him a thank-you note, Jennifer thoughtfully bought Victor a nice down comforter as a token of gratitude.","After sending him a thank-you note, the","After sending him a thank-you note, the MASKTOKEN thoughtfully bought Victor a nice down comforter as a token of gratitude.","After sending him a thank-you note, the",woman,9.253741264343262,8.333176612854004,7.946091651916504,8.647706031799316,9.617562294006348,9.036528587341309,9.187085151672363,9.229175567626953,9.355435371398926,9.166199684143066,10.096445083618164,9.663032531738281,9.573381423950195,9.709576606750488,9.553196907043457,8.544309616088867,9.300901412963867,8.524620056152344,9.372380256652832,8.660125732421875,9.355470657348633,9.902473449707031,10.404537200927734,9.479292869567871,9.543545722961426
19,CATAMARAN2-FIN-Match,No Constraint,Match,her,"Before a chaperon took her kids on the roller coaster, Victoria calmly reassured Andrea that the loop wasn't dangerous at all.","Before a chaperon took her kids on the roller coaster, the","Before a chaperon took her kids on the roller coaster, the MASKTOKEN calmly reassured Andrea that the loop wasn't dangerous at all.","Before a chaperon took her kids on the roller coaster, the",woman,9.25456428527832,9.072396278381348,10.08788013458252,9.23745059967041,10.155725479125977,9.56457805633545,9.307687759399414,8.881260871887207,9.62236213684082,8.104705810546875,9.793526649475098,11.070751190185547,9.433439254760742,8.012348175048828,10.133090019226074,9.117319107055664,8.567863464355469,8.481939315795898,10.36590576171875,8.744176864624023,9.825804710388184,10.245752334594727,10.571882247924805,8.846952438354492,9.60355281829834
19,CATAMARAN2-FIN-Misma,No Constraint,Mismatch,his,"Before a chaperon took his kids on the roller coaster, Victoria calmly reassured Lucas that the loop wasn't dangerous at all.","Before a chaperon took his kids on the roller coaster, the","Before a chaperon took his kids on the roller coaster, the MASKTOKEN calmly reassured Lucas that the loop wasn't dangerous at all.","Before a chaperon took his kids on the roller coaster, the",woman,10.204501152038574,10.056114196777344,10.979337692260742,10.547720909118652,11.361956596374512,10.454642295837402,10.285107612609863,10.05501651763916,10.926687240600586,9.309696197509766,11.025188446044922,11.633305549621582,10.090536117553711,9.140337944030762,11.313624382019043,10.02475357055664,9.414335250854492,9.526226997375488,10.994392395019531,10.370922088623047,10.596844673156738,10.881845474243164,11.723206520080566,10.05457592010498,10.589693069458008
19,CATAMARAN2-OBJ-Match,Constraint,Match,her,"Before taking her on the roller coaster, Victoria calmly reassured Andrea that the loop wasn't dangerous at all.","Before taking her on the roller coaster, the","Before taking her on the roller coaster, the MASKTOKEN calmly reassured Andrea that the loop wasn't dangerous at all.","Before taking her on the roller coaster, the",woman,9.731002807617188,9.038909912109375,10.365948677062988,9.287277221679688,10.402338981628418,9.998693466186523,9.617199897766113,8.699211120605469,9.841018676757812,9.04880142211914,10.803858757019043,10.775983810424805,9.474763870239258,8.315776824951172,10.929255485534668,9.455836296081543,9.055830001831055,8.745731353759766,10.270559310913086,9.06359577178955,9.862741470336914,9.947641372680664,10.54775333404541,8.625922203063965,9.569807052612305
19,CATAMARAN2-OBJ-Misma,Constraint,Mismatch,him,"Before taking him on the roller coaster, Victoria calmly reassured Lucas that the loop wasn't dangerous at all.","Before taking him on the roller coaster, the","Before taking him on the roller coaster, the MASKTOKEN calmly reassured Lucas that the loop wasn't dangerous at all.","Before taking him on the roller coaster, the",woman,10.571985244750977,10.026251792907715,11.228489875793457,10.567375183105469,11.632615089416504,11.106375694274902,10.431849479675293,10.035425186157227,10.811948776245117,9.998804092407227,11.545652389526367,11.415647506713867,10.089383125305176,9.529150009155273,11.764314651489258,10.295374870300293,10.025938987731934,9.69101333618164,10.84850025177002,10.680971145629883,10.52568244934082,10.676051139831543,11.77972412109375,9.785792350769043,10.551527976989746
20,CATAMARAN2-FIN-Match,No Constraint,Match,her,"After anyone took her to a social event, Rebecca always checked with Julia to see whether they actually had a good time.","After anyone took her to a social event, the","After anyone took her to a social event, the MASKTOKEN always checked with Julia to see whether they actually had a good time.","After anyone took her to a social event, the",woman,9.101369857788086,8.09688663482666,8.713881492614746,7.942638874053955,9.069144248962402,8.941644668579102,8.652421951293945,7.567733287811279,8.596219062805176,7.562057971954346,9.933605194091797,10.223076820373535,8.793152809143066,7.762258529663086,9.463695526123047,8.552132606506348,8.472770690917969,8.69575023651123,7.964231491088867,7.8957200050354,9.212006568908691,9.527950286865234,9.082491874694824,8.562514305114746,8.808725357055664
20,CATAMARAN2-FIN-Misma,No Constraint,Mismatch,him,"After anyone took him to a social event, Rebecca always checked with Elijah to see whether they actually had a good time.","After anyone took him to a social event, the","After anyone took him to a social event, the MASKTOKEN always checked with Elijah to see whether they actually had a good time.","After anyone took him to a social event, the",woman,9.753990173339844,9.005898475646973,9.637211799621582,8.995392799377441,9.930699348449707,9.886322021484375,9.551082611083984,8.932219505310059,9.4653902053833,8.639087677001953,10.72832202911377,10.691947937011719,9.303462028503418,8.94670581817627,10.310284614562988,9.204444885253906,9.365399360656738,9.548306465148926,8.809954643249512,9.276745796203613,9.947094917297363,10.09822940826416,10.082723617553711,9.420092582702637,9.746072769165039
20,CATAMARAN2-OBJ-Match,Constraint,Match,her,"After taking her to a social event, Rebecca always checked with Julia to see whether she actually had a good time.","After taking her to a social event, the","After taking her to a social event, the MASKTOKEN always checked with Julia to see whether she actually had a good time.","After taking her to a social event, the",woman,9.106965065002441,7.835419178009033,9.014552116394043,7.778486251831055,9.245944023132324,8.976895332336426,8.65208625793457,7.636680603027344,8.305996894836426,7.421919345855713,9.957792282104492,10.078360557556152,8.429743766784668,7.310575008392334,9.681634902954102,8.671574592590332,8.450822830200195,8.619154930114746,8.343642234802246,7.957900047302246,8.817790031433105,9.181367874145508,8.774003982543945,8.63119125366211,9.234129905700684
20,CATAMARAN2-OBJ-Misma,Constraint,Mismatch,him,"After taking him to a social event, Rebecca always checked with Elijah to see whether he actually had a good time.","After taking him to a social event, the","After taking him to a social event, the MASKTOKEN always checked with Elijah to see whether he actually had a good time.","After taking him to a social event, the",woman,9.968221664428711,8.949841499328613,9.945015907287598,8.955434799194336,10.34542179107666,10.04201889038086,9.855069160461426,9.14292049407959,9.264791488647461,8.571075439453125,10.797178268432617,10.620108604431152,9.057355880737305,8.608041763305664,10.514774322509766,9.418243408203125,9.623055458068848,9.704586029052734,9.035460472106934,9.704614639282227,9.74295425415039,9.92469596862793,9.825645446777344,9.62161922454834,10.146371841430664
21,CATAMARAN2-FIN-Match,No Constraint,Match,her,"Before auctioneers showed her any new paintings, Catherine typically consulted Kelly to see which pieces were the best.","Before auctioneers showed her any new paintings, the","Before auctioneers showed her any new paintings, the MASKTOKEN typically consulted Kelly to see which pieces were the best.","Before auctioneers showed her any new paintings, the",woman,9.235320091247559,9.337156295776367,9.111735343933105,9.465614318847656,10.15146255493164,9.154170989990234,9.298320770263672,8.425249099731445,9.293044090270996,9.116766929626465,10.18185043334961,10.216764450073242,9.01201057434082,8.80280590057373,10.721733093261719,9.626530647277832,9.044695854187012,9.313361167907715,9.096489906311035,9.313180923461914,9.525252342224121,9.721283912658691,9.225484848022461,8.959810256958008,9.255513191223145
21,CATAMARAN2-FIN-Misma,No Constraint,Mismatch,him,"Before auctioneers showed him any new paintings, Catherine typically consulted Shawn to see which pieces were the best.","Before auctioneers showed him any new paintings, the","Before auctioneers showed him any new paintings, the MASKTOKEN typically consulted Shawn to see which pieces were the best.","Before auctioneers showed him any new paintings, the",woman,10.47610855102539,10.666131973266602,10.446677207946777,10.990263938903809,11.989470481872559,10.579532623291016,10.785170555114746,10.107973098754883,10.500621795654297,10.418944358825684,11.574023246765137,10.841192245483398,9.836111068725586,10.3032865524292,11.677506446838379,10.911993026733398,9.908409118652344,10.294746398925781,10.421310424804688,11.258613586425781,10.427797317504883,10.620467185974121,11.020480155944824,10.50027084350586,10.981161117553711
21,CATAMARAN2-OBJ-Match,Constraint,Match,her,"Before showing her any new paintings, Catherine typically consulted Kelly to see which pieces were the best.","Before showing her any new paintings, the","Before showing her any new paintings, the MASKTOKEN typically consulted Kelly to see which pieces were the best.","Before showing her any new paintings, the",woman,8.91959285736084,9.003917694091797,8.954876899719238,9.52337646484375,9.97407341003418,9.208553314208984,9.410832405090332,8.433666229248047,8.995451927185059,8.995497703552246,10.181584358215332,10.07397174835205,8.825029373168945,8.465265274047852,10.524423599243164,9.52961540222168,8.781275749206543,9.088966369628906,8.70151138305664,8.997225761413574,8.921350479125977,9.458657264709473,8.942913055419922,8.866945266723633,8.907792091369629
21,CATAMARAN2-OBJ-Misma,Constraint,Mismatch,him,"Before showing him any new paintings, Catherine typically consulted Shawn to see which pieces were the best.","Before showing him any new paintings, the","Before showing him any new paintings, the MASKTOKEN typically consulted Shawn to see which pieces were the best.","Before showing him any new paintings, the",woman,10.358543395996094,10.526860237121582,10.364267349243164,11.038674354553223,11.811249732971191,10.662960052490234,10.89238452911377,10.147506713867188,10.335182189941406,10.214885711669922,11.47083568572998,10.837973594665527,9.856890678405762,10.190932273864746,11.511251449584961,10.834725379943848,9.768461227416992,10.101044654846191,10.219317436218262,11.180191993713379,10.146598815917969,10.586549758911133,10.62682819366455,10.451008796691895,10.641902923583984
22,CATAMARAN2-FIN-Match,No Constraint,Match,her,"After a student nominated her for class president, Nicole publicly humiliated Destiny by sharing a private conversation all over social media.","After a student nominated her for class president, the","After a student nominated her for class president, the MASKTOKEN publicly humiliated Destiny by sharing a private conversation all over social media.","After a student nominated her for class president, the",woman,9.028841018676758,7.673359394073486,8.113533020019531,8.926390647888184,9.205202102661133,8.798870086669922,7.893951416015625,8.51362419128418,8.836642265319824,8.788840293884277,9.587202072143555,9.743687629699707,9.519233703613281,7.737250328063965,9.31581974029541,8.480916023254395,9.812739372253418,8.94772720336914,9.017285346984863,9.035255432128906,9.24790096282959,9.701173782348633,9.28195858001709,8.378442764282227,9.51987361907959
22,CATAMARAN2-FIN-Misma,No Constraint,Mismatch,him,"After a student nominated him for class president, Nicole publicly humiliated Jerome by sharing a private conversation all over social media.","After a student nominated him for class president, the","After a student nominated him for class president, the MASKTOKEN publicly humiliated Jerome by sharing a private conversation all over social media.","After a student nominated him for class president, the",woman,9.978437423706055,9.075263977050781,9.486572265625,10.257990837097168,9.873156547546387,9.954534530639648,9.70219898223877,9.575892448425293,9.859611511230469,10.065888404846191,11.267426490783691,10.446606636047363,10.336018562316895,8.906839370727539,10.413634300231934,9.836555480957031,10.886077880859375,9.933297157287598,10.116579055786133,10.40976619720459,10.134166717529297,10.367777824401855,10.209160804748535,9.969202995300293,11.171916961669922
22,CATAMARAN2-OBJ-Match,Constraint,Match,her,"After nominating her for class president, Nicole publicly humiliated Destiny by sharing a private conversation all over social media.","After nominating her for class president, the","After nominating her for class president, the MASKTOKEN publicly humiliated Destiny by sharing a private conversation all over social media.","After nominating her for class president, the",woman,9.590240478515625,7.6616082191467285,8.970466613769531,9.244483947753906,9.411270141601562,9.876270294189453,9.239562034606934,8.543081283569336,9.401728630065918,8.626018524169922,10.179328918457031,9.789948463439941,10.10201358795166,8.045831680297852,9.591808319091797,9.431233406066895,9.462367057800293,9.14824390411377,9.266087532043457,9.393380165100098,9.65455436706543,10.371237754821777,9.85751724243164,9.161250114440918,9.638266563415527
22,CATAMARAN2-OBJ-Misma,Constraint,Mismatch,him,"After nominating him for class president, Nicole publicly humiliated Jerome by sharing a private conversation all over social media.","After nominating him for class president, the","After nominating him for class president, the MASKTOKEN publicly humiliated Jerome by sharing a private conversation all over social media.","After nominating him for class president, the",woman,11.027826309204102,9.356443405151367,10.257708549499512,10.552906036376953,10.54578685760498,11.564663887023926,10.72208309173584,10.030634880065918,10.432924270629883,10.138566017150879,10.982441902160645,10.52607536315918,11.04291820526123,9.52698040008545,10.646358489990234,10.882954597473145,10.82945442199707,10.403514862060547,10.197120666503906,10.922696113586426,10.612944602966309,11.04506778717041,11.138519287109375,10.763570785522461,11.108555793762207
23,CATAMARAN2-FIN-Match,No Constraint,Match,her,"After everyone watched her on the Voice, Kimberly immediately called up Selena to discuss some of the highlights of the performance.","After everyone watched her on the Voice, the","After everyone watched her on the Voice, the MASKTOKEN immediately called up Selena to discuss some of the highlights of the performance.","After everyone watched her on the Voice, the",woman,8.650753021240234,8.100112915039062,7.573310852050781,8.261488914489746,8.546716690063477,8.264301300048828,7.472728729248047,7.544040679931641,8.586878776550293,7.530952453613281,9.30047607421875,9.445009231567383,8.142669677734375,7.325984954833984,9.157005310058594,8.205254554748535,8.45167350769043,7.770211696624756,7.913400650024414,7.677665710449219,8.927811622619629,8.986612319946289,9.139156341552734,7.520941734313965,7.592107772827148
23,CATAMARAN2-FIN-Misma,No Constraint,Mismatch,him,"After everyone watched him on the Voice, Kimberly immediately called up Francisco to discuss some of the highlights of the performance.","After everyone watched him on the Voice, the","After everyone watched him on the Voice, the MASKTOKEN immediately called up Francisco to discuss some of the highlights of the performance.","After everyone watched him on the Voice, the",woman,9.888182640075684,9.163864135742188,8.786609649658203,9.545827865600586,9.797578811645508,9.666820526123047,8.39421272277832,9.06141185760498,9.743016242980957,8.572808265686035,10.401285171508789,10.193947792053223,8.829057693481445,8.923620223999023,10.228140830993652,9.149658203125,9.662094116210938,9.085854530334473,8.592351913452148,9.315216064453125,9.918644905090332,10.088170051574707,10.573996543884277,8.735563278198242,8.860014915466309
