23,CATAMARAN2-OBJ-Match,Constraint,Match,her,"After watching her on the Voice, Kimberly immediately called up Selena to discuss some of the highlights of the performance.","After watching her on the Voice, the","After watching her on the Voice, the MASKTOKEN immediately called up Selena to discuss some of the highlights of the performance.","After watching her on the Voice, the",woman,8.38903522491455,7.946354866027832,8.01998519897461,8.426281929016113,8.230493545532227,8.708154678344727,7.060157299041748,7.612678527832031,8.621891021728516,7.2511749267578125,9.59723949432373,9.237455368041992,8.276679992675781,7.659317493438721,9.247636795043945,8.134679794311523,8.253512382507324,7.933006286621094,8.293251991271973,7.871204853057861,8.725918769836426,8.913636207580566,9.069245338439941,7.382937908172607,7.429231643676758
23,CATAMARAN2-OBJ-Misma,Constraint,Mismatch,him,"After watching him on the Voice, Kimberly immediately called up Francisco to discuss some of the highlights of the performance.","After watching him on the Voice, the","After watching him on the Voice, the MASKTOKEN immediately called up Francisco to discuss some of the highlights of the performance.","After watching him on the Voice, the",woman,9.714140892028809,9.145943641662598,9.280220031738281,9.620648384094238,9.53618335723877,9.960155487060547,8.071756362915039,9.219348907470703,9.521862030029297,8.625205993652344,10.545608520507812,9.896583557128906,9.056668281555176,8.887518882751465,10.459858894348145,9.388751983642578,9.671647071838379,9.247960090637207,9.062809944152832,9.422213554382324,9.755229949951172,10.052494049072266,10.420294761657715,8.730082511901855,8.65853214263916
24,CATAMARAN2-FIN-Match,No Constraint,Match,her,"Before a secretary sent her the secret contract, Rachel repeatedly made Crystal promise not to disclose the terms to anyone.","Before a secretary sent her the secret contract, the","Before a secretary sent her the secret contract, the MASKTOKEN repeatedly made Crystal promise not to disclose the terms to anyone.","Before a secretary sent her the secret contract, the",woman,10.090188980102539,9.438700675964355,9.37954044342041,9.836247444152832,10.235252380371094,9.22530746459961,9.210607528686523,9.657156944274902,10.945295333862305,8.939217567443848,10.414505958557129,10.813922882080078,10.361296653747559,9.314456939697266,11.034563064575195,10.091031074523926,10.182717323303223,9.05023193359375,9.673675537109375,9.178918838500977,10.23184871673584,10.513204574584961,10.60957145690918,9.859769821166992,10.100655555725098
24,CATAMARAN2-FIN-Misma,No Constraint,Mismatch,him,"Before a secretary sent him the secret contract, Rachel repeatedly made Raymond promise not to disclose the terms to anyone.","Before a secretary sent him the secret contract, the","Before a secretary sent him the secret contract, the MASKTOKEN repeatedly made Raymond promise not to disclose the terms to anyone.","Before a secretary sent him the secret contract, the",woman,11.270813941955566,10.33609390258789,10.482725143432617,11.305689811706543,11.154257774353027,11.162824630737305,10.49350357055664,10.838336944580078,11.79315185546875,10.598856925964355,11.392351150512695,11.727295875549316,11.182181358337402,10.563163757324219,11.872854232788086,10.91046142578125,11.21438217163086,10.158960342407227,11.281163215637207,10.750792503356934,11.391331672668457,11.447690963745117,12.203696250915527,11.169378280639648,11.469626426696777
24,CATAMARAN2-OBJ-Match,Constraint,Match,her,"Before sending her the secret contract, Rachel repeatedly made Crystal promise not to disclose the terms to anyone.","Before sending her the secret contract, the","Before sending her the secret contract, the MASKTOKEN repeatedly made Crystal promise not to disclose the terms to anyone.","Before sending her the secret contract, the",woman,9.426798820495605,8.84901237487793,9.327346801757812,9.424683570861816,9.558063507080078,8.928374290466309,8.948262214660645,9.034163475036621,9.813475608825684,8.887929916381836,10.742794036865234,10.147890090942383,10.258360862731934,8.357306480407715,10.920677185058594,9.57120418548584,9.819753646850586,8.901738166809082,9.604347229003906,8.863738059997559,10.083873748779297,10.139530181884766,10.247184753417969,9.073533058166504,9.952138900756836
24,CATAMARAN2-OBJ-Misma,Constraint,Mismatch,him,"Before sending him the secret contract, Rachel repeatedly made Raymond promise not to disclose the terms to anyone.","Before sending him the secret contract, the","Before sending him the secret contract, the MASKTOKEN repeatedly made Raymond promise not to disclose the terms to anyone.","Before sending him the secret contract, the",woman,10.600451469421387,10.08039379119873,10.602362632751465,11.112299919128418,10.978354454040527,10.947042465209961,10.314238548278809,10.577681541442871,11.057029724121094,10.409130096435547,11.869343757629395,11.370390892028809,11.090221405029297,9.78786849975586,11.910103797912598,10.761857986450195,10.95304012298584,9.843574523925781,10.520362854003906,10.588972091674805,11.296954154968262,11.212250709533691,11.841907501220703,10.727636337280273,11.109750747680664
